{
  "schemaVersion": "1.0",
  "authorizationId": "auth-composite-001",
  "planId": "plan-composite-001",
  "semanticHash": "0x1b741a931c4680699ae5b9909dbe3b0f4da301b92e5c510e6be2fff20564628b",
  "renderReceiptHash": "0xf968ef734ad00884c51cd1606a5969c2cadb86e83f2116ae429219bcc0915eeb",
  "sourceStateHash": "0x484c668fb22a353b6c55a355e95f88b075ccfca93b514ffe961c736c798bb30d",
  "promptTextHash": "0x4cad6a7c16b957f884ea68a30b834a75bcd07b7da4c7467867703516e112d8af",
  "deviceId": "pixel9a-demo-001",
  "platform": "ANDROID",
  "authorizationAssurance": "TRUSTED_CONFIRMATION",
  "presentationMode": "ANDROID_PROTECTED_CONFIRMATION",
  "authType": "AUTH_PER_USE",
  "challenge": "QUFBQUFBQUFBQUFBQUFBQUFBQUFBQUFBQUFBQUFBQUE",
  "issuedAt": "2026-07-28T12:10:02+09:00",
  "expiresAt": "2026-07-28T12:10:30+09:00",
  "oneTimeUse": true,
  "integrityToken": null,
  "evidence": {
    "kind": "ANDROID_PROTECTED_CONFIRMATION",
    "confirmationKeyId": "confirmation-key-demo-001",
    "confirmationTokenBase64Url": "VEVTVF9PTkxZX1BST1RFQ1RFRF9DT05GSVJNQVRJT05fVE9LRU4",
    "attestationChainDigest": "0xaaaaaaaaaaaaaaaaaaaaaaaaaaaaaaaaaaaaaaaaaaaaaaaaaaaaaaaaaaaaaaaa"
  }
}
